{
    "topicId": 19, 
    "postDate": "974316326", 
    "spamInfo": {
        "reason": "0", 
        "isSpam": false
    }, 
    "from": "&quot;Piero Campanelli&quot; &lt;pierolists@...&gt;", 
    "canDelete": false, 
    "replyTo": "LIST", 
    "senderId": "ERv0TeYt0386CDD6x2wd6_I0w5HBD-8EQQ0fxqlm81VJ923rMIfACSReuYUBTuiFw2a6dfWfmy8s7x1dlIC6K95dnIkhAHHO6T0G4nzialnJ_ZAy5Q", 
    "nextInTime": 20, 
    "userId": 0, 
    "prevInTime": 18, 
    "prevInTopic": 0, 
    "headers": {
        "messageIdInHeader": "PFBHRUJJQU1MTUZOS09PSUNNSEtGQUVBRENDQUEucGllcm9saXN0c0BjYW1wYW5lbGxpLm9yZz4="
    }, 
    "authorName": "Piero Campanelli", 
    "numMessagesInTopic": 2, 
    "msgSnippet": "Hi, have tried to use JUnit 3.2 in VaJAVA 3.5 as an IDE tool ? I am unable to figure out how to do it ....have you any help ? Tnx", 
    "contentTrasformed": false, 
    "msgId": 19, 
    "nextInTopic": 21, 
    "systemMessage": false, 
    "rawEmail": "Return-Path: &lt;pierolists@...&gt;\r\nX-Sender: pierolists@...\r\nX-Apparently-To: junit@egroups.com\r\nReceived: (EGP: mail-6_2_1); 15 Nov 2000 19:26:13 -0000\r\nReceived: (qmail 23352 invoked from network); 15 Nov 2000 19:26:13 -0000\r\nReceived: from unknown (10.1.10.26) by m4.onelist.org with QMQP; 15 Nov 2000 19:26:13 -0000\r\nReceived: from unknown (HELO xfile.mlab.disco.unimi.it) (149.132.196.20) by mta1 with SMTP; 15 Nov 2000 19:26:13 -0000\r\nReceived: from laptop (SERVER [213.167.199.252]) by xfile.mlab.disco.unimi.it with SMTP (Microsoft Exchange Internet Mail Service Version 5.5.2448.0) id WNP74TVR; Wed, 15 Nov 2000 20:26:09 +0100\r\nTo: &lt;junit@egroups.com&gt;\r\nSubject: JUnit and VaJava 3.5\r\nDate: Wed, 15 Nov 2000 20:25:26 +0100\r\nMessage-ID: &lt;PGEBIAMLMFNKOOICMHKFAEADCCAA.pierolists@...&gt;\r\nMIME-Version: 1.0\r\nContent-Type: text/plain; charset=&quot;iso-8859-1&quot;\r\nContent-Transfer-Encoding: 7bit\r\nX-Priority: 3 (Normal)\r\nX-MSMail-Priority: Normal\r\nX-Mailer: Microsoft Outlook IMO, Build 9.0.2416 (9.0.2910.0)\r\nX-MimeOLE: Produced By Microsoft MimeOLE V5.50.4133.2400\r\nImportance: Normal\r\nFrom: &quot;Piero Campanelli&quot; &lt;pierolists@...&gt;\r\n\r\nHi,\n\nhave tried to use JUnit 3.2 in VaJAVA 3.5 as an IDE tool ?\nI am unable to figure out how to do it ....have you any help ?\n\nTnx\n\n\n", 
    "subject": "JUnit and VaJava 3.5"
}