{
    "topicId": 1, 
    "postDate": "973527045", 
    "spamInfo": {
        "reason": "0", 
        "isSpam": false
    }, 
    "from": "&quot;Vincent Massol&quot; &lt;vmassol@...&gt;", 
    "canDelete": false, 
    "replyTo": "LIST", 
    "senderId": "NMG3_n5mS5fqs42fxm8jsmwoWYuT7CjQLvxQD7Mi6Bdkomg5xQQv31Slb3hQExPKFYHlgBO06gWDHkuBN_1z4cd68xVxA4aiBQ", 
    "nextInTime": 2, 
    "userId": 0, 
    "prevInTime": 0, 
    "prevInTopic": 0, 
    "headers": {
        "messageIdInHeader": "PDh1Nmw2NSs5cjNzQGVHcm91cHMuY29tPg=="
    }, 
    "authorName": "Vincent Massol", 
    "numMessagesInTopic": 19, 
    "msgSnippet": "I am a fan of JUnit ! I have been working with it for some time now and I have come up with an extension of it for testing server-side java code that is called", 
    "contentTrasformed": false, 
    "msgId": 1, 
    "nextInTopic": 2, 
    "systemMessage": false, 
    "rawEmail": "Return-Path: &lt;vmassol@...&gt;\r\nX-Sender: vmassol@...\r\nX-Apparently-To: junit@egroups.com\r\nReceived: (EGP: mail-6_2_1); 6 Nov 2000 16:16:33 -0000\r\nReceived: (qmail 78701 invoked from network); 6 Nov 2000 16:10:56 -0000\r\nReceived: from unknown (10.1.10.142) by m8.onelist.org with QMQP; 6 Nov 2000 16:10:56 -0000\r\nReceived: from unknown (HELO hi.egroups.com) (10.1.10.41) by mta3 with SMTP; 6 Nov 2000 17:12:01 -0000\r\nX-eGroups-Return: vmassol@...\r\nReceived: from [10.1.10.118] by hi.egroups.com with NNFMP; 06 Nov 2000 16:10:55 -0000\r\nDate: Mon, 06 Nov 2000 16:10:45 -0000\r\nTo: junit@egroups.com\r\nSubject: J2EEUnit\r\nMessage-ID: &lt;8u6l65+9r3s@...&gt;\r\nUser-Agent: eGroups-EW/0.82\r\nMIME-Version: 1.0\r\nContent-Type: text/plain; charset=ISO-8859-1\r\nContent-Length: 362\r\nX-Mailer: eGroups Message Poster\r\nFrom: &quot;Vincent Massol&quot; &lt;vmassol@...&gt;\r\n\r\nI am a fan of JUnit ! I have been working with it for some time now \nand I have come up with an extension of it for testing server-side \njava code that is called either by Servlets or JSP. I thought that \nyou could find this of interest ...\n \nPlease have a loot at it at http://sourceforge.net/projects/j2eeunit/ \nand tell me what you think\n\nThanks.\nVincent.\n \n\n\n\n", 
    "subject": "J2EEUnit"
}