{
    "numMessagesInTopic": 4, 
    "nextInTime": 20240, 
    "senderId": "EVVUj89AwTuAy5YTq8o97mz53wHopS85k7kFWlSfosoRtMKzcc5WV5QG6bSBLmWOSB3yxW5yenSjy2S83O8vPLitXaijS5WE1UlsM7c", 
    "systemMessage": true, 
    "subject": "Set Returning method", 
    "from": "&quot;pankaj khare&quot; &lt;pankaj.0405@...&gt;", 
    "authorName": "pankaj khare", 
    "msgSnippet": "how to write junit test case of method which are return Set or List. code of methods // for test public Set getPredecessors() { if (this.predecessors != null) ", 
    "msgId": 20239, 
    "rawEmail": "Return-Path: &lt;pankaj.0405@...&gt;\r\nReceived: (qmail 47869 invoked from network); 15 Jan 2008 12:23:30 -0000\r\nReceived: from unknown (66.218.67.95)\n  by m56.grp.scd.yahoo.com with QMQP; 15 Jan 2008 12:23:30 -0000\r\nReceived: from unknown (HELO n11.bullet.mail.re1.yahoo.com) (69.147.103.138)\n  by mta16.grp.scd.yahoo.com with SMTP; 15 Jan 2008 12:23:29 -0000\r\nReceived: from [68.142.237.89] by n11.bullet.mail.re1.yahoo.com with NNFMP; 15 Jan 2008 12:23:29 -0000\r\nReceived: from [66.218.69.1] by t5.bullet.re3.yahoo.com with NNFMP; 15 Jan 2008 12:23:29 -0000\r\nReceived: from [66.218.66.82] by t1.bullet.scd.yahoo.com with NNFMP; 15 Jan 2008 12:23:29 -0000\r\nX-Sender: pankaj.0405@...\r\nX-Apparently-To: junit@yahoogroups.com\r\nX-Received: (qmail 11165 invoked from network); 15 Jan 2008 11:51:13 -0000\r\nX-Received: from unknown (66.218.67.95)\n  by m55.grp.scd.yahoo.com with QMQP; 15 Jan 2008 11:51:13 -0000\r\nX-Received: from unknown (HELO an-out-0708.google.com) (209.85.132.245)\n  by mta16.grp.scd.yahoo.com with SMTP; 15 Jan 2008 11:51:13 -0000\r\nX-Received: by an-out-0708.google.com with SMTP id c37so1358138anc.78\n        for &lt;junit@yahoogroups.com&gt;; Tue, 15 Jan 2008 03:51:12 -0800 (PST)\r\nX-Received: by 10.100.201.16 with SMTP id y16mr16563521anf.83.1200397872611;\n        Tue, 15 Jan 2008 03:51:12 -0800 (PST)\r\nX-Received: by 10.100.92.19 with HTTP; Tue, 15 Jan 2008 03:51:12 -0800 (PST)\r\nMessage-ID: &lt;b5af0c710801150351o11a7055rea29b6e97db4b33e@...&gt;\r\nDate: Tue, 15 Jan 2008 17:21:12 +0530\r\nTo: junit@yahoogroups.com\r\nMIME-Version: 1.0\r\nX-eGroups-Msg-Info: 1:12:0:0:0\r\nFrom: &quot;pankaj khare&quot; &lt;pankaj.0405@...&gt;\r\nSubject: Set Returning method\r\nX-Yahoo-Group-Post: member; u=331996991; y=1vUIubXNno0Jn--AmwQBKtsHCcXzv-J810W8MAnH14KlwDavCOI\r\nX-Yahoo-Profile: pankaj_0405\r\nContent-Type: text/plain; charset=US-ASCII\r\nContent-Transfer-Encoding: 7bit\r\nX-Yahoo-Newman-Property: groups-system\r\nX-eGroups-Approved-By: spchappell &lt;simonpeterchappell@...&gt; via web; 15 Jan 2008 12:23:28 -0000\r\n\r\nhow to write junit test case of method which are return Set or List.\n\ncode of methods\n\n// for test\n\n\n\n public Set getPredecessors()\n    {\n    if (this.predecessors != null)\n    {\n        StringBuffer sbId = new StringBuffer();\n        sbId.append(&quot;&quot;);\n\n        for (Iterator iter = this.predecessors.iterator(); iter.hasNext();)\n        {\n        WorkflowStepPredecessor wsp = (WorkflowStepPredecessor) iter\n        .next();\n        // Lonmg ws=wsd.getPredecessorId();\n        if (sbId.toString().equals(&quot;&quot;))\n        {\n            sbId.append(wsp.getPredecessorStep().getWfPosition());\n        } else\n        {\n            sbId.append(&quot;,&quot;).append(\n                wsp.getPredecessorStep().getWfPosition());\n        }\n        }\n        setPredecessorsIds(sbId.toString());\n    }\n    return this.predecessors;\n    }\n\n\n// setter method\n\n\npublic void setPredecessors(Set predecessors)\n    {\n\n    this.predecessors = predecessors;\n    }\n\n\n\ni got class cast exception\nif i write following code\n\n\npublic void testGetPredecessors()\n    {\n    //MockControl controlPd=MockControl.createControl(Set.class);\n    //Set mockPd=(Set)controlPd.getMock();\n    //mockPd.add(&quot;ok&quot;);\n    //mockPd.toString();\n    //controlPd.setReturnValue(&quot;ok&quot;);\n    //controlPd.replay();\n\n    predecessors=new TreeSet();\n    predecessors.add(&quot;pk&quot;);\n    predecessors.toString();\n\n    ws.setPredecessors(predecessors);\n    Assert.assertEquals(&quot;pk&quot;,ws.getPredecessors());\n    //controlPd.verify();\n    }\n\n\n[Non-text portions of this message have been removed]\n\n\n", 
    "profile": "pankaj_0405", 
    "topicId": 20239, 
    "spamInfo": {
        "reason": "12", 
        "isSpam": false
    }, 
    "replyTo": "LIST", 
    "userId": 331996991, 
    "prevInTime": 20238, 
    "contentTrasformed": false, 
    "postDate": "1200397872", 
    "canDelete": false, 
    "nextInTopic": 20240, 
    "prevInTopic": 0, 
    "headers": {
        "messageIdInHeader": "PGI1YWYwYzcxMDgwMTE1MDM1MW8xMWE3MDU1cmVhMjliNmU5N2RiNGIzM2VAbWFpbC5nbWFpbC5jb20+"
    }
}