{
    "numMessagesInTopic": 3, 
    "nextInTime": 20757, 
    "senderId": "U01R4AyyoP9nh3Xc2AKErWEEudKvbZl25OHAiow8zbLyka9ytgVzNvVp3muaa05Yi4nwsqjukF5Yx_xA69sNPPt7EWfUteRm_3LGpQP5halJjE2mRz1l9ik0vu-8jJbhEQ", 
    "systemMessage": true, 
    "subject": "Order of multiple @Before methods in one class", 
    "from": "&quot;Robin de Silva Jayasinghe&quot; &lt;robin.desilva@...&gt;", 
    "authorName": "Robin de Silva Jayasinghe", 
    "msgSnippet": "Hi List! Today I asked myself whether there is a given order if I decorate multiple methods in one class with @Before or @After. All of the methods are", 
    "msgId": 20756, 
    "rawEmail": "Return-Path: &lt;robin.desilva@...&gt;\r\nReceived: (qmail 80827 invoked from network); 4 Aug 2008 13:38:42 -0000\r\nReceived: from unknown (66.218.67.94)\n  by m51.grp.scd.yahoo.com with QMQP; 4 Aug 2008 13:38:42 -0000\r\nReceived: from unknown (HELO n39b.bullet.mail.sp1.yahoo.com) (66.163.168.153)\n  by mta15.grp.scd.yahoo.com with SMTP; 4 Aug 2008 13:38:42 -0000\r\nReceived: from [216.252.122.218] by n39.bullet.mail.sp1.yahoo.com with NNFMP; 04 Aug 2008 13:38:42 -0000\r\nReceived: from [66.218.69.1] by t3.bullet.sp1.yahoo.com with NNFMP; 04 Aug 2008 13:38:42 -0000\r\nReceived: from [66.218.66.86] by t1.bullet.scd.yahoo.com with NNFMP; 04 Aug 2008 13:38:42 -0000\r\nX-Sender: robin.desilva@...\r\nX-Apparently-To: junit@yahoogroups.com\r\nX-Received: (qmail 35929 invoked from network); 4 Aug 2008 11:57:41 -0000\r\nX-Received: from unknown (66.218.67.95)\n  by m47.grp.scd.yahoo.com with QMQP; 4 Aug 2008 11:57:41 -0000\r\nX-Received: from unknown (HELO wf-out-1314.google.com) (209.85.200.172)\n  by mta16.grp.scd.yahoo.com with SMTP; 4 Aug 2008 11:57:41 -0000\r\nX-Received: by wf-out-1314.google.com with SMTP id 24so4074752wfg.15\n        for &lt;junit@yahoogroups.com&gt;; Mon, 04 Aug 2008 04:57:41 -0700 (PDT)\r\nX-Received: by 10.143.37.20 with SMTP id p20mr4912172wfj.236.1217851061242;\n        Mon, 04 Aug 2008 04:57:41 -0700 (PDT)\r\nX-Received: by 10.142.115.21 with HTTP; Mon, 4 Aug 2008 04:57:41 -0700 (PDT)\r\nMessage-ID: &lt;b05834e70808040457y4e4ee981o47f2b4173a25edd9@...&gt;\r\nDate: Mon, 4 Aug 2008 13:57:41 +0200\r\nTo: junit@yahoogroups.com\r\nMIME-Version: 1.0\r\nContent-Type: text/plain; charset=ISO-8859-1\r\nContent-Transfer-Encoding: 7bit\r\nContent-Disposition: inline\r\nX-eGroups-Msg-Info: 1:12:0:0:0\r\nFrom: &quot;Robin de Silva Jayasinghe&quot; &lt;robin.desilva@...&gt;\r\nSubject: Order of multiple @Before methods in one class\r\nX-Yahoo-Group-Post: member; u=348617342; y=d7xg_7N9HjcNrZcijTC9cOv0HHqmru6TEssMuORXaKdMTpE2-w\r\nX-Yahoo-Profile: robinjay33\r\nX-Yahoo-Newman-Property: groups-system\r\nX-eGroups-Approved-By: mark_l_salter &lt;marksalter@...&gt; via web; 04 Aug 2008 13:38:38 -0000\r\n\r\nHi List!\n\nToday I asked myself whether there is a given order if I decorate\nmultiple methods in one class with @Before or @After. All of the\nmethods are executed but I have no idea how JUnit determines the\nexecution order. I changed the ordering of the methods in the source\ncode as well as the name of the methods. Both with no effect on the\nordering. Is there any defined order or shall I rely on the assumption\nthat the order is undefined?\n\nBest Regards,\nRobin\n\n", 
    "profile": "robinjay33", 
    "topicId": 20756, 
    "spamInfo": {
        "reason": "12", 
        "isSpam": false
    }, 
    "replyTo": "LIST", 
    "userId": 348617342, 
    "prevInTime": 20755, 
    "contentTrasformed": false, 
    "postDate": "1217851061", 
    "canDelete": false, 
    "nextInTopic": 20757, 
    "prevInTopic": 0, 
    "headers": {
        "messageIdInHeader": "PGIwNTgzNGU3MDgwODA0MDQ1N3k0ZTRlZTk4MW80N2YyYjQxNzNhMjVlZGQ5QG1haWwuZ21haWwuY29tPg=="
    }
}