{
    "numMessagesInTopic": 1, 
    "nextInTime": 20785, 
    "senderId": "nBLacoJ1beE4ciZbQIYJzUxUAcHcoWL0rSfktE_FdbRvISBS9bhO6ubTLl9tyB-0rwTa8Jm04RddxrwimPOB7XTGuNs", 
    "systemMessage": false, 
    "subject": "JUnit 4.5 is released", 
    "from": "&quot;David Saff&quot; &lt;david@...&gt;", 
    "authorName": "David Saff", 
    "msgSnippet": "All, JUnit 4.5 focuses on features that make life easier for JUnit extensions, including new public extension points for inserting behavior into the standard", 
    "msgId": 20784, 
    "rawEmail": "Return-Path: &lt;david.saff@...&gt;\r\nX-Sender: david.saff@...\r\nX-Apparently-To: junit@yahoogroups.com\r\nX-Received: (qmail 73832 invoked from network); 8 Aug 2008 19:42:48 -0000\r\nX-Received: from unknown (66.218.67.96)\n  by m43.grp.scd.yahoo.com with QMQP; 8 Aug 2008 19:42:48 -0000\r\nX-Received: from unknown (HELO yx-out-2324.google.com) (74.125.44.30)\n  by mta17.grp.scd.yahoo.com with SMTP; 8 Aug 2008 19:42:48 -0000\r\nX-Received: by yx-out-2324.google.com with SMTP id 8so284257yxb.65\n        for &lt;junit@yahoogroups.com&gt;; Fri, 08 Aug 2008 12:42:48 -0700 (PDT)\r\nX-Received: by 10.151.111.15 with SMTP id o15mr7895515ybm.7.1218224567841;\n        Fri, 08 Aug 2008 12:42:47 -0700 (PDT)\r\nX-Received: by 10.150.198.2 with HTTP; Fri, 8 Aug 2008 12:42:47 -0700 (PDT)\r\nMessage-ID: &lt;4f7da6b90808081242o547cd124r9c559e45d4866684@...&gt;\r\nDate: Fri, 8 Aug 2008 15:42:47 -0400\r\nTo: &quot;junit@yahoogroups.com&quot; &lt;junit@yahoogroups.com&gt;, \n\tjunit-devel &lt;Junit-devel@...&gt;, \n\tjunit-announce@...\r\nMIME-Version: 1.0\r\nContent-Type: text/plain; charset=ISO-8859-1\r\nContent-Transfer-Encoding: 7bit\r\nContent-Disposition: inline\r\nX-Google-Sender-Auth: 1d46ffc3fcd3b2fd\r\nX-eGroups-Msg-Info: 1:12:0:0:0\r\nFrom: &quot;David Saff&quot; &lt;david@...&gt;\r\nSubject: JUnit 4.5 is released\r\nX-Yahoo-Group-Post: member; u=341876227; y=vqZmwYfc31PzRakff8G_Sl2auOw9zLVF6MKhc4sj5Fw\r\nX-Yahoo-Profile: dsaff\r\n\r\nAll,\n\nJUnit 4.5 focuses on features that make life easier for JUnit\nextensions, including new public extension points for inserting\nbehavior into the standard JUnit 4 class runner.\n\nPlease download at:\n\nhttp://sourceforge.net/project/showfiles.php?group_id=15278&package_id=12472&abmode=1\n\nThe release notes follow:\n\n## Summary of Changes in version 4.5 ##\n\n### Installation ###\n\n- We are releasing `junit-4.5.jar`, which contains all the classes\n  necessary to run JUnit, and `junit-dep-4.5.jar`, which leaves out\n  hamcrest classes, for developers who already use hamcrest outside of\n  JUnit.\n\n### Basic JUnit operation ###\n\n- JUnitCore now more often exits with the correct exit code (0 for\n  success, 1 for failure)\n\n- Badly formed test classes (exceptions in constructors, classes\n  without tests, multiple constructors, Suite without @SuiteClasses)\n  produce more helpful error messages\n\n- Test classes whose only test methods are inherited from superclasses\n  now run.\n\n- Optimization to annotation processing can cut JUnit overhead by more than half\n  on large test classes, especially when using Theories.  [Bug 1796847]\n\n- A failing assumption in a constructor ignores the class\n\n- Correct results when comparing the string &quot;null&quot; with potentially\n  null values.  [Bug 1857283]\n\n- Annotating a class with `@RunWith(JUnit4.class)` will always invoke the\n  default JUnit 4 runner in the current version of JUnit.  This default changed\n  from `JUnit4ClassRunner` in 4.4 to `BlockJUnit4ClassRunner` in 4.5\n(see below),\n  and may change again.\n\n### Extension ###\n\n- `BlockJUnit4Runner` is a new implementation of the standard JUnit 4\n  test class functionality.  In contrast to `JUnit4ClassRunner` (the old\n  implementation):\n\n  - `BlockJUnit4Runner` has a much simpler implementation based on\n    Statements, allowing new operations to be inserted into the\n    appropriate point in the execution flow.\n\n  - `BlockJUnit4Runner` is published, and extension and reuse are\n    encouraged, whereas `JUnit4ClassRunner` was in an internal package,\n    and is now deprecated.\n\n- `ParentRunner` is a base class for runners that iterate over\n  a list of &quot;children&quot;, each an object representing a test or suite to run.\n  `ParentRunner` provides filtering, sorting, `@BeforeClass`, `@AfterClass`,\n  and method validation to subclasses.\n\n- `TestClass` wraps a class to be run, providing efficient, repeated access\n  to all methods with a given annotation.\n\n- The new `RunnerBuilder` API allows extending the behavior of\n  Suite-like custom runners.\n\n- `AssumptionViolatedException.toString()` is more informative\n\n### Extra Runners ###\n\n- `Parameterized.eachOne()` has been removed\n\n- New runner `Enclosed` runs all static inner classes of an outer class.\n\n### Theories ###\n\n- `@Before` and `@After` methods are run before and after each set of\nattempted parameters\n  on a Theory, and each set of parameters is run on a new instance of\nthe test class.\n\n- Exposed API&#39;s `ParameterSignature.getType()` and\n`ParameterSignature.getAnnotations()`\n\n- An array of data points can be introduced by a field or method\n  marked with the new annotation `@DataPoints`\n\n- The Theories custom runner has been refactored to make it faster and\n  easier to extend\n\n### Development ###\n\n- Source has been split into directories `src/main/java` and\n  `src/test/java`, making it easier to exclude tests from builds, and\n  making JUnit more maven-friendly\n\n- Test classes in `org.junit.tests` have been organized into\n  subpackages, hopefully making finding tests easier.\n\n- `ResultMatchers` has more informative descriptions.\n\n- `TestSystem` allows testing return codes and other system-level interactions.\n\n", 
    "profile": "dsaff", 
    "topicId": 20784, 
    "spamInfo": {
        "reason": "12", 
        "isSpam": false
    }, 
    "replyTo": "LIST", 
    "userId": 341876227, 
    "prevInTime": 20783, 
    "contentTrasformed": false, 
    "postDate": "1218224567", 
    "canDelete": false, 
    "nextInTopic": 0, 
    "prevInTopic": 0, 
    "headers": {
        "messageIdInHeader": "PDRmN2RhNmI5MDgwODA4MTI0Mm81NDdjZDEyNHI5YzU1OWU0NWQ0ODY2Njg0QG1haWwuZ21haWwuY29tPg=="
    }
}