{
    "numMessagesInTopic": 4, 
    "nextInTime": 20999, 
    "senderId": "g6EqgyEAqqDJnsCl_5c67H71pJLwiRLMMo0zqVmij-e8XgD02WRO2jG0jEGWo2kj2k3Mv42GuDUZCv90NtUviJZTvdKbaSk9Y_TH", 
    "systemMessage": true, 
    "subject": "Paramaters Collection type", 
    "from": "&quot;Raphael Parree&quot; &lt;rparree@...&gt;", 
    "authorName": "Raphael Parree", 
    "msgSnippet": "Hi, Is there any particular reason why the JavaDoc and numerous examples state that the return of a @Parameters method is Collection, when it in fact it may", 
    "msgId": 20998, 
    "rawEmail": "Return-Path: &lt;rparree@...&gt;\r\nReceived: (qmail 18125 invoked from network); 22 Oct 2008 10:48:24 -0000\r\nReceived: from unknown (66.218.67.94)\n  by m52.grp.scd.yahoo.com with QMQP; 22 Oct 2008 10:48:24 -0000\r\nReceived: from unknown (HELO n33a.bullet.sp1.yahoo.com) (209.131.38.214)\n  by mta15.grp.scd.yahoo.com with SMTP; 22 Oct 2008 10:48:23 -0000\r\nDKIM-Signature: v=1; a=rsa-sha256; c=relaxed/relaxed; d=yahoogroups.com; s=lima; t=1224672503; bh=9qm6Ha9BRA/FHXwUjGQWx0mcuczDaI7Y5MevBAnQfUM=; h=Received:Received:Received:Received:X-Sender:X-Apparently-To:X-Received:X-Received:X-Received:X-Received:X-Received:X-Received:Message-ID:Date:To:MIME-Version:X-Originating-IP:X-eGroups-Msg-Info:From:Subject:X-Yahoo-Group-Post:X-Yahoo-Profile:Content-Type:Content-Transfer-Encoding:Sender:X-Yahoo-Newman-Property:X-eGroups-Approved-By:X-eGroups-Auth; b=ii1Z5Njmq1Iyn/sqPpZRxwvtCHd8teS5i62a4cDzKdf8hmhXjYM4dHLxfnmFu4KSegrXLlqqM7ZWKdO4EsDwzu0+bOFXieE+AHRBfbg1Vrvym3W8zc+pMJ1dEmNQ+1wV\r\nReceived: from [69.147.65.172] by n33.bullet.sp1.yahoo.com with NNFMP; 22 Oct 2008 10:48:23 -0000\r\nReceived: from [66.218.69.5] by t14.bullet.mail.sp1.yahoo.com with NNFMP; 22 Oct 2008 10:48:23 -0000\r\nReceived: from [69.147.65.173] by t5.bullet.scd.yahoo.com with NNFMP; 22 Oct 2008 10:48:23 -0000\r\nReceived: from [66.218.66.91] by t15.bullet.mail.sp1.yahoo.com with NNFMP; 22 Oct 2008 10:48:23 -0000\r\nX-Sender: rparree@...\r\nX-Apparently-To: junit@yahoogroups.com\r\nX-Received: (qmail 39287 invoked from network); 22 Oct 2008 10:44:53 -0000\r\nX-Received: from unknown (66.218.67.95)\n  by m36.grp.scd.yahoo.com with QMQP; 22 Oct 2008 10:44:53 -0000\r\nX-Received: from unknown (HELO ik-out-1112.google.com) (66.249.90.179)\n  by mta16.grp.scd.yahoo.com with SMTP; 22 Oct 2008 10:44:52 -0000\r\nX-Received: by ik-out-1112.google.com with SMTP id c21so2188450ika.6\n        for &lt;junit@yahoogroups.com&gt;; Wed, 22 Oct 2008 03:44:52 -0700 (PDT)\r\nX-Received: by 10.210.24.7 with SMTP id 7mr11724468ebx.98.1224672292070;\n        Wed, 22 Oct 2008 03:44:52 -0700 (PDT)\r\nX-Received: by 10.210.58.4 with HTTP; Wed, 22 Oct 2008 03:44:52 -0700 (PDT)\r\nMessage-ID: &lt;f33d51740810220344k213f89dflbc9687280994e17f@...&gt;\r\nDate: Wed, 22 Oct 2008 12:44:52 +0200\r\nTo: junit@yahoogroups.com\r\nMIME-Version: 1.0\r\nX-eGroups-Msg-Info: 1:12:0:0:0\r\nFrom: &quot;Raphael Parree&quot; &lt;rparree@...&gt;\r\nSubject: Paramaters Collection type\r\nX-Yahoo-Group-Post: member; u=363885179; y=upZHs5mliYa5xL-5RF9e4P3nJnqBYLMmYUodvZ4RN7Ju-g\r\nX-Yahoo-Profile: rparree\r\nContent-Type: text/plain; charset=US-ASCII\r\nContent-Transfer-Encoding: 7bit\r\nX-Yahoo-Newman-Property: groups-system\r\nX-eGroups-Approved-By: mark_l_salter &lt;marksalter@...&gt; via web; 22 Oct 2008 10:48:20 -0000\r\n\r\nHi,\n\nIs there any particular reason why the JavaDoc and numerous examples state\nthat the return of a @Parameters method is Collection, when it in fact it\nmay only be a List&lt;Object[]&gt;?\n\ntx.,\n\nRaphael\n\n\n[Non-text portions of this message have been removed]\n\n\n", 
    "profile": "rparree", 
    "topicId": 20998, 
    "spamInfo": {
        "reason": "12", 
        "isSpam": false
    }, 
    "replyTo": "LIST", 
    "userId": 363885179, 
    "prevInTime": 20997, 
    "contentTrasformed": false, 
    "postDate": "1224672292", 
    "canDelete": false, 
    "nextInTopic": 20999, 
    "prevInTopic": 0, 
    "headers": {
        "messageIdInHeader": "PGYzM2Q1MTc0MDgxMDIyMDM0NGsyMTNmODlkZmxiYzk2ODcyODA5OTRlMTdmQG1haWwuZ21haWwuY29tPg=="
    }
}