{
    "numMessagesInTopic": 33, 
    "nextInTime": 21597, 
    "senderId": "DoFFx3iZOEv_jfNoitUieiw0M11QpYkbyPaAzdUcDH3sh67Zj4CCLFhXW66ZYl-lbd-Wa2M7KyBqAeY9YPsnyw8qYUBIR3WJ_HNxEahWcBmSVYkd", 
    "systemMessage": false, 
    "subject": "Missing API: Assert.assertThat(boolean) or IsCollection.isEmpty()", 
    "from": "Martijn Dashorst &lt;martijn.dashorst@...&gt;", 
    "authorName": "Martijn Dashorst", 
    "msgSnippet": "I just discovered that the hamcrest like API misses a nice method to assert the true-ness of boolean methods. Writing: assertThat(list.isEmpty(), is(true)); ", 
    "msgId": 21596, 
    "rawEmail": "Return-Path: &lt;martijn.dashorst@...&gt;\r\nX-Sender: martijn.dashorst@...\r\nX-Apparently-To: junit@yahoogroups.com\r\nX-Received: (qmail 37386 invoked from network); 13 May 2009 13:06:13 -0000\r\nX-Received: from unknown (69.147.108.202)\n  by m8.grp.re1.yahoo.com with QMQP; 13 May 2009 13:06:13 -0000\r\nX-Received: from unknown (HELO mail-bw0-f162.google.com) (209.85.218.162)\n  by mta3.grp.re1.yahoo.com with SMTP; 13 May 2009 13:06:13 -0000\r\nX-Received: by bwz6 with SMTP id 6so650413bwz.21\n        for &lt;junit@yahoogroups.com&gt;; Wed, 13 May 2009 06:05:12 -0700 (PDT)\r\nMIME-Version: 1.0\r\nX-Received: by 10.103.171.6 with SMTP id y6mr656355muo.110.1242219912706; Wed, \n\t13 May 2009 06:05:12 -0700 (PDT)\r\nDate: Wed, 13 May 2009 15:05:12 +0200\r\nMessage-ID: &lt;918312fe0905130605i2d08f95dpfc19ba870992f87f@...&gt;\r\nTo: junit@yahoogroups.com\r\nContent-Type: text/plain; charset=ISO-8859-1\r\nContent-Transfer-Encoding: 7bit\r\nX-eGroups-Msg-Info: 1:12:0:0:0\r\nFrom: Martijn Dashorst &lt;martijn.dashorst@...&gt;\r\nSubject: Missing API: Assert.assertThat(boolean) or IsCollection.isEmpty()\r\nX-Yahoo-Group-Post: member; u=240822343; y=R66r0-os_rcAhXG_TPevg9QrHWB0CrtCjMKhJg3clnImm5Roljbw-U0TNQ\r\nX-Yahoo-Profile: martijn_dashorst\r\n\r\nI just discovered that the hamcrest like API misses a nice method to\nassert the true-ness of boolean methods.\n\nWriting:\n\nassertThat(list.isEmpty(), is(true));\n\nfeels less natural than:\n\nassertThat(list.isEmpty());\n\nor\n\nassertThat(list, isEmpty());\n\nOr am I overlooking some API?\n\nMartijn\n\n", 
    "profile": "martijn_dashorst", 
    "topicId": 21596, 
    "spamInfo": {
        "reason": "12", 
        "isSpam": false
    }, 
    "replyTo": "LIST", 
    "userId": 240822343, 
    "prevInTime": 21595, 
    "contentTrasformed": false, 
    "postDate": "1242219912", 
    "canDelete": false, 
    "nextInTopic": 21597, 
    "prevInTopic": 0, 
    "headers": {
        "messageIdInHeader": "PDkxODMxMmZlMDkwNTEzMDYwNWkyZDA4Zjk1ZHBmYzE5YmE4NzA5OTJmODdmQG1haWwuZ21haWwuY29tPg=="
    }
}