{
    "numMessagesInTopic": 3, 
    "nextInTime": 21959, 
    "senderId": "BA6bsePXv6RBngfTloaBD98an3NYPNp0mit5h723gY5X8nPEoFvvECPguNm719LAGo-Pc6wSd9H5rGDlJqC5WyAgKQ17XYRofVUBVU6Ne27a", 
    "systemMessage": true, 
    "subject": "Deprectated Extension Point org.eclipse.jdt.junit.testRunListeners", 
    "from": "Tim Felgentreff &lt;timfelgentreff@...&gt;", 
    "authorName": "Tim Felgentreff", 
    "msgSnippet": "Eclipse (and various online sources) tell me the extension point org.eclipse.jdt.junit.testRunListeners is deprecated. After some hours of research I still", 
    "msgId": 21958, 
    "rawEmail": "Return-Path: &lt;timfelgentreff@...&gt;\r\nReceived: (qmail 838 invoked from network); 8 Oct 2009 22:43:11 -0000\r\nReceived: from unknown (98.137.34.46)\n  by m8.grp.re1.yahoo.com with QMQP; 8 Oct 2009 22:43:11 -0000\r\nReceived: from unknown (HELO n44d.bullet.mail.sp1.yahoo.com) (66.163.169.158)\n  by mta3.grp.sp2.yahoo.com with SMTP; 8 Oct 2009 22:43:11 -0000\r\nDKIM-Signature: v=1; a=rsa-sha256; c=relaxed/relaxed; d=yahoogroups.com; s=lima; t=1255041791; bh=FodL7GJFEHAOSwUleZVlH42pFLEpGg6QY29FHd4SDmU=; h=Received:Received:X-Sender:X-Apparently-To:X-Received:X-Received:X-Received:X-Received:X-Received:X-Received:To:Content-Type:Date:Message-Id:Mime-Version:X-Mailer:Content-Transfer-Encoding:X-Originating-IP:X-eGroups-Msg-Info:From:Subject:X-Yahoo-Group-Post:X-Yahoo-Profile:X-YGroups-SubInfo:Sender:X-Yahoo-Newman-Property:X-eGroups-Approved-By:X-eGroups-Auth; b=FiqO67atbSL5wBlfenH+UIt7kRo8Xmwotyhp1w//3NrNeWdg8gVnqDsfeh7mMSoOM86IqyruiS4L1TYWIBDl4rYAC+pBLTkSr3fMdWyupFs8Or5eEjtlx1SC5pi5o2XP\r\nReceived: from [69.147.65.171] by n44.bullet.mail.sp1.yahoo.com with NNFMP; 08 Oct 2009 22:43:11 -0000\r\nReceived: from [98.137.34.33] by t13.bullet.mail.sp1.yahoo.com with NNFMP; 08 Oct 2009 22:43:11 -0000\r\nX-Sender: timfelgentreff@...\r\nX-Apparently-To: junit@yahoogroups.com\r\nX-Received: (qmail 51093 invoked from network); 8 Oct 2009 12:46:09 -0000\r\nX-Received: from unknown (98.137.34.46)\n  by m1.grp.sp2.yahoo.com with QMQP; 8 Oct 2009 12:46:09 -0000\r\nX-Received: from unknown (HELO mail-fx0-f207.google.com) (209.85.220.207)\n  by mta3.grp.sp2.yahoo.com with SMTP; 8 Oct 2009 12:46:09 -0000\r\nX-Received: by fxm3 with SMTP id 3so5265389fxm.44\n        for &lt;junit@yahoogroups.com&gt;; Thu, 08 Oct 2009 05:46:08 -0700 (PDT)\r\nX-Received: by 10.103.125.35 with SMTP id c35mr516296mun.30.1255005968276;\n        Thu, 08 Oct 2009 05:46:08 -0700 (PDT)\r\nX-Received: from ?172.16.23.111? ([141.89.226.149])\n        by mx.google.com with ESMTPS id e9sm3202835muf.9.2009.10.08.05.46.07\n        (version=SSLv3 cipher=RC4-MD5);\n        Thu, 08 Oct 2009 05:46:07 -0700 (PDT)\r\nTo: junit@yahoogroups.com\r\nContent-Type: text/plain\r\nDate: Thu, 08 Oct 2009 14:46:05 +0200\r\nMessage-Id: &lt;1255005965.3340.12.camel@...-potsdam.de&gt;\r\nMime-Version: 1.0\r\nX-Mailer: Evolution 2.26.3 (2.26.3-1.fc11) \r\nContent-Transfer-Encoding: 7bit\r\nX-eGroups-Msg-Info: 1:12:0:0:0\r\nFrom: Tim Felgentreff &lt;timfelgentreff@...&gt;\r\nSubject: Deprectated Extension Point org.eclipse.jdt.junit.testRunListeners\r\nX-Yahoo-Group-Post: member; u=416608738; y=NtWaykJmhF0yZXgZESUvC_U3Jv2qSduMRWLjnBbQ2Oncbk8hFNmPxA\r\nX-Yahoo-Profile: timfelgentreff\r\nX-YGroups-SubInfo: t=0;f=16;g=Pwa_e1LnvuOqzEbR6LQYJjw5lVTHChpx-97VYEa_v7flzzxkLKfjASe6Q6nHdEG8lCM;\r\nX-Yahoo-Newman-Property: groups-system\r\nX-eGroups-Approved-By: spchappell &lt;simonpeterchappell@...&gt; via web; 08 Oct 2009 22:43:09 -0000\r\n\r\nEclipse (and various online sources) tell me the extension point\norg.eclipse.jdt.junit.testRunListeners is deprecated.\nAfter some hours of research I still haven&#39;t found a suitable \nalternative.\nI need an additional view on the results of JUnit runs that offers \nsome actions depending on the test results. How would I go about\ndoing that with current JUnit4?\nThe @RunWith annotation is unsuitable for my situation, as I need \nto run unit tests not written by myself on different systems with \ndifferent plug-ins. \n\n--\nRegards,\nTim\n\n\n", 
    "profile": "timfelgentreff", 
    "topicId": 21958, 
    "spamInfo": {
        "reason": "12", 
        "isSpam": false
    }, 
    "replyTo": "LIST", 
    "userId": 416608738, 
    "prevInTime": 21957, 
    "contentTrasformed": false, 
    "postDate": "1255005965", 
    "canDelete": false, 
    "nextInTopic": 21959, 
    "prevInTopic": 0, 
    "headers": {
        "messageIdInHeader": "PDEyNTUwMDU5NjUuMzM0MC4xMi5jYW1lbEBicDIwMDloMXdzMDMuaHBpLnVuaS1wb3RzZGFtLmRlPg=="
    }
}