{
    "numMessagesInTopic": 14, 
    "nextInTime": 22881, 
    "senderId": "Q667Rj8MnvewlJsxLJ2ssNFZDza1ueTXz5OXfSN_Nr8vb6nrnPkoIgM3u9DfA5cVLbiiTvSa4xwa3E1FRyiJwyCAhOZ5XglWpGO6Y4cwPdayMYvo", 
    "systemMessage": false, 
    "subject": "More example JUnit code", 
    "from": "Simon Chappell &lt;simonpeterchappell@...&gt;", 
    "authorName": "Simon Chappell", 
    "msgSnippet": "Following up on my previous offering of example JUnit code, I have pushed a project called Fraction to GitHub. This implements classic mathematical fractions", 
    "msgId": 22880, 
    "rawEmail": "Return-Path: &lt;simonpeterchappell@...&gt;\r\nX-Sender: simonpeterchappell@...\r\nX-Apparently-To: junit@yahoogroups.com\r\nX-Received: (qmail 18544 invoked from network); 22 Aug 2010 22:47:14 -0000\r\nX-Received: from unknown (98.137.34.44)\n  by m2.grp.sp2.yahoo.com with QMQP; 22 Aug 2010 22:47:14 -0000\r\nX-Received: from unknown (HELO mail-bw0-f53.google.com) (209.85.214.53)\n  by mta1.grp.sp2.yahoo.com with SMTP; 22 Aug 2010 22:47:14 -0000\r\nX-Received: by bwz18 with SMTP id 18so5918476bwz.40\n        for &lt;junit@yahoogroups.com&gt;; Sun, 22 Aug 2010 15:47:13 -0700 (PDT)\r\nMIME-Version: 1.0\r\nX-Received: by 10.204.79.223 with SMTP id q31mr3109199bkk.92.1282517231846; Sun,\n 22 Aug 2010 15:47:11 -0700 (PDT)\r\nX-Received: by 10.204.62.4 with HTTP; Sun, 22 Aug 2010 15:47:11 -0700 (PDT)\r\nDate: Sun, 22 Aug 2010 17:47:11 -0500\r\nMessage-ID: &lt;AANLkTikv4gPxGg-hCw+svedTeYebT+k9wRNXZEFdwFTE@...&gt;\r\nTo: junit@yahoogroups.com\r\nFrom: Simon Chappell &lt;simonpeterchappell@...&gt;\r\nSubject: More example JUnit code\r\nX-Yahoo-Group-Post: member; u=211142374; y=t4nXWSFuA3MdOG_E1UgvPWo8k6lNln44D8H-Pn-4lYDbk8Z1ew\r\nX-Yahoo-Profile: spchappell\r\nContent-Type: text/plain; charset=US-ASCII\r\nContent-Transfer-Encoding: 7bit\r\n\r\nFollowing up on my previous offering of example JUnit code, I have pushed a\nproject called Fraction to GitHub. This implements classic mathematical\nfractions and was written in a test first manner and has documented unit\ntests to help those learning JUnit see one style (my style!) of test\nimplementation.\n\nThe code may be found at:\n\nhttp://github.com/simonpeter/Fraction\n\nI hope that you find it useful.\n\nSimon\n(one of the JUnit mailing list moderators)\n\n-- \nsimonpeter.org | simonpeter.com | newlife-upc.org\n\n\n[Non-text portions of this message have been removed]\n\n\n", 
    "profile": "spchappell", 
    "topicId": 22880, 
    "spamInfo": {
        "reason": "0", 
        "isSpam": false
    }, 
    "replyTo": "LIST", 
    "userId": 211142374, 
    "prevInTime": 22879, 
    "contentTrasformed": false, 
    "postDate": "1282517231", 
    "canDelete": false, 
    "nextInTopic": 22881, 
    "prevInTopic": 0, 
    "headers": {
        "messageIdInHeader": "PEFBTkxrVGlrdjRnUHhHZy1oQ3crc3ZlZFRlWWViVCtrOXdSTlhaRUZkd0ZURUBtYWlsLmdtYWlsLmNvbT4="
    }
}