{
    "numMessagesInTopic": 1, 
    "nextInTime": 24417, 
    "senderId": "U2LMUnfJ3s-xcU3S44kWG2yyML6mjEb-HsGMkY3g06n1a3comeKXLKKT4aYgq34kQJuD7Kvom7h9mGfw1ZHjXP64", 
    "systemMessage": false, 
    "subject": "salutations..", 
    "from": "archer &lt;archerzz@...&gt;", 
    "authorName": "archer", 
    "msgSnippet": "http://filip.millecam.be/etkiy/nhyfbntzdprmgvvtiec Mingzhe Huang 7/23/2013 7:25:16 AM", 
    "msgId": 24416, 
    "rawEmail": "Return-Path: &lt;archerzz@...&gt;\r\nX-Sender: archerzz@...\r\nX-Apparently-To: junit@yahoogroups.com\r\nX-Received: (qmail 95143 invoked by uid 102); 23 Jul 2013 06:25:24 -0000\r\nX-Received: from unknown (HELO mtaq1.grp.bf1.yahoo.com) (10.193.84.32)\n  by m5.grp.bf1.yahoo.com with SMTP; 23 Jul 2013 06:25:24 -0000\r\nX-Received: (qmail 3354 invoked from network); 23 Jul 2013 06:25:24 -0000\r\nX-Received: from unknown (HELO mail-pa0-f52.google.com) (209.85.220.52)\n  by mtaq1.grp.bf1.yahoo.com with SMTP; 23 Jul 2013 06:25:24 -0000\r\nX-Received: by mail-pa0-f52.google.com with SMTP id kq13so2436571pab.25\n        for &lt;multiple recipients&gt;; Mon, 22 Jul 2013 23:25:24 -0700 (PDT)\r\nMIME-Version: 1.0\r\nX-Received: by 10.69.14.165 with SMTP id fh5mr4775830pbd.81.1374560723956;\n Mon, 22 Jul 2013 23:25:23 -0700 (PDT)\r\nX-Received: by 10.70.10.100 with HTTP; Mon, 22 Jul 2013 23:25:23 -0700 (PDT)\r\nDate: Tue, 23 Jul 2013 14:25:23 +0800\r\nMessage-ID: &lt;CAHcA6bO0uaRwpqUw31hpGmamOJkdO1k-29fFune9YEH1Pb66DA@...&gt;\r\nTo: franchescakaessler83@..., daniel.huasilei@..., \n\tnyudong@..., panpam19@..., stella_zhuxy@..., \n\tarcher.huang@..., chenzhuang2000@..., guanghong@..., \n\trachel_zrj@..., realityshen@..., chenming_sx@..., \n\tsleepingbaby119@..., sales@..., naer333@..., \n\tgtalkchinese@..., eno@..., bugs@..., \n\tzh2en@..., eliteworld@..., italk.cn@..., \n\tsdfurr@..., ling_huang8@..., veon_zs@..., \n\treckall_lee@..., zenonline@..., zhaspe@..., \n\tfarocean007@..., xinjie@..., bridges@..., \n\twangjianhui1008@..., zoe_april@..., sichen_zhou@..., \n\tyuanpeng.zhang@..., ypan@..., hmz_smart@..., \n\tgroups.mygtalk.cn@..., dreaming_cat_7@..., xminyu@..., \n\tarcherzz@..., princess_kid@..., dannylau55@..., \n\twxl_snow@..., chengming@..., jasonau.hk@..., \n\tcarlos26.h@..., yubin_ha_ha_ha@..., majordomo@..., \n\tfarocean007@..., playfulflurt68@..., ccmitchellusa@..., \n\tlijunsh@..., zhaoruilin@..., zhuhua1006@..., \n\tkanrss-com@..., kevinsit@..., se2003tj@..., \n\tjszsgsugar@..., yyc@..., junit@yahoogroups.com, \n\thuangmz@..., richard_lee_cn@..., ddstrue@..., \n\tcharlie.tong@..., superchongchong@..., joycejjy@..., \n\tyunjuan@..., crquan@..., houyongr@..., \n\tn_nicolas_cage@..., luchao0190@..., jove.shi@..., \n\twentschao@..., machao_sh@..., yingjiazhong@..., \n\trealityshen@..., tongwenchao@..., jhjiangb@..., \n\tfancy_gasmine@..., gladyszj@..., shen_lujie@..., \n\tguweinan@..., ycchina@..., tongjishirong002689@..., \n\tviviantjy@..., pongba@..., jarodzz@..., \n\thaperkelu@..., gentoo-gwn-subscribe@..., jianglq@..., \n\tchinesegtalk@..., kevincysit@..., dingbaobei2001@..., \n\tgroups.gtalk.ch@..., amble_shisu@..., panxiongfei@..., \n\tzhengruzqx@..., wjz_md@..., lu.luchao0190@..., \n\tconfirmations@..., archerzz@..., fans@..., \n\tshenyud@..., donglirjj@..., houyr@..., \n\tironsolder@..., zhouyunpeng0425@..., mafias007@..., \n\tluyu0221@..., apollobush@..., hwanghk@..., \n\toliver_shen@..., starsy@..., wo@..., \n\trobert.zhangle@..., cigaretting@..., zhling@..., \n\tzuoshou2132@..., archerzz.tech@..., penny2046@..., \n\tviabot@..., qbxiong@..., su.shi@..., lancj1982@..., \n\tlaurence_yu@..., nick.maillist@..., momo_lu@..., \n\tabc005@..., services@..., fanfou008@..., \n\tluyu0221@..., daniel_huasilei@..., xiongcore@..., \n\tcnzyy@..., shenlujie@..., cbbxkk@..., arhuang@..., \n\tEriczhao82@..., python-chinese-request@..., \n\tnyudong@..., chenshuHAO@..., guanfang@..., \n\tpython-chinese@..., junit-unsubscribe@yahoogroups.com, \n\tliangjiaying73@..., Kevin.Sit@..., \n\ttongwenchao@..., mryufeng@..., wangjianhui1008@..., \n\tcold799@..., jszsg@..., \n\tauth-37d4044667f185e42ffbfd8f9b310424@..., chenlihua02@..., \n\tguiguisdf@..., pigirlinsky@...\r\nContent-Type: text/plain; charset=UTF-8\r\nX-eGroups-Msg-Info: 1:12:0:0:0\r\nFrom: archer &lt;archerzz@...&gt;\r\nSubject: salutations..\r\nX-Yahoo-Group-Post: member; u=201743011; y=PXQWdY0f2VlLlUrJqc2FgPR5SeRKPcUCFGZWWig2naFxQxemgF8\r\nX-Yahoo-Profile: archerzz101\r\n\r\n http://filip.millecam.be/etkiy/nhyfbntzdprmgvvtiec\n\n\n\n\n\n\n\n\n\n\n\n\n\n\n\n\n\n Mingzhe Huang\n\n\n\n\n\n\n\n\n\n\n\n 7/23/2013 7:25:16 AM\n\n", 
    "profile": "archerzz101", 
    "topicId": 24416, 
    "spamInfo": {
        "reason": "12", 
        "isSpam": false
    }, 
    "replyTo": "LIST", 
    "userId": 201743011, 
    "prevInTime": 24415, 
    "contentTrasformed": false, 
    "postDate": "1374560723", 
    "canDelete": false, 
    "nextInTopic": 0, 
    "prevInTopic": 0, 
    "headers": {
        "messageIdInHeader": "PENBSGNBNmJPMHVhUndwcVV3MzFocEdtYW1PSmtkTzFrLTI5ZkZ1bmU5WUVIMVBiNjZEQUBtYWlsLmdtYWlsLmNvbT4="
    }
}