{
    "topicId": 449, 
    "postDate": "982144880", 
    "spamInfo": {
        "reason": "0", 
        "isSpam": false
    }, 
    "from": "Heinz van Pee &lt;vanpee@...&gt;", 
    "canDelete": false, 
    "replyTo": "LIST", 
    "senderId": "3vR9SY-yAM4ngF6JRPkwnUChwELc9pjpGTmFw6PuVVYQ4IYNpCgjStdq-tfR7IMXBBQkC9HHpdoDqQiChgjYyEEQDfU", 
    "nextInTime": 450, 
    "userId": 0, 
    "prevInTime": 448, 
    "prevInTopic": 0, 
    "headers": {
        "messageIdInHeader": "PDE1MTY2Ljk4MjE0NDg4MEB3d3czMC5nbXgubmV0Pg=="
    }, 
    "authorName": "Heinz van Pee", 
    "numMessagesInTopic": 3, 
    "msgSnippet": "Hello, i have a question about JUnit: Is it possible to influence the order of the Tests? I have some test methods in a Testcase and would like to have them", 
    "contentTrasformed": false, 
    "msgId": 449, 
    "nextInTopic": 450, 
    "systemMessage": false, 
    "rawEmail": "Return-Path: &lt;vanpee@...&gt;\r\nX-Sender: vanpee@...\r\nX-Apparently-To: junit@yahoogroups.com\r\nReceived: (EGP: mail-7_0_3); 14 Feb 2001 10:01:22 -0000\r\nReceived: (qmail 76400 invoked from network); 14 Feb 2001 10:01:22 -0000\r\nReceived: from unknown (10.1.10.26) by m8.onelist.org with QMQP; 14 Feb 2001 10:01:22 -0000\r\nReceived: from unknown (HELO www30.gmx.net) (213.165.64.80) by mta1 with SMTP; 14 Feb 2001 10:01:21 -0000\r\nReceived: (qmail 15209 invoked by uid 0); 14 Feb 2001 10:01:20 -0000\r\nDate: Wed, 14 Feb 2001 11:01:20 +0100 (MET)\r\nTo: junit@yahoogroups.com\r\nMIME-Version: 1.0\r\nSubject: Order of Tests\r\nX-Priority: 3 (Normal)\r\nX-Authenticated-Sender: #0001349693@...\r\nX-Authenticated-IP: [194.140.119.250]\r\nMessage-ID: &lt;15166.982144880@...&gt;\r\nX-Mailer: WWW-Mail 1.5 (Global Message Exchange)\r\nX-Flags: 0001\r\nContent-Type: text/plain; charset=&quot;us-ascii&quot;\r\nContent-Transfer-Encoding: 7bit\r\nFrom: Heinz van Pee &lt;vanpee@...&gt;\r\n\r\nHello,\ni have a question about JUnit:\nIs it possible to influence the order of the Tests?\nI have some test methods in a Testcase and would like to \nhave them executed in a specific order, for some tests\nreley on the success of others.\nIs there any way to do this?\n\nKind Regards,\n    Heinz van Pee\n\n-- \nAlles ist relativ!\nWEB: http://www.vanpeeheinz.de\n\n\n", 
    "subject": "Order of Tests"
}