{
    "topicId": 49, 
    "postDate": "974863113", 
    "spamInfo": {
        "reason": "0", 
        "isSpam": false
    }, 
    "from": "&quot;Erik Meade&quot; &lt;emeade@...&gt;", 
    "canDelete": false, 
    "replyTo": "LIST", 
    "senderId": "blmYPHNmjzZbLiNKJtq6zzCYlJ-hPQa3P98U6ssJEp-g4TDOglUJJeCTJSCs2x5M_Cq52ORnTFofJtGJnCHbGBGXCzzPNZLOaA", 
    "nextInTime": 50, 
    "userId": 0, 
    "prevInTime": 48, 
    "prevInTopic": 0, 
    "headers": {
        "messageIdInHeader": "PERHRUxKR05NQk1HRUhGQ0tKTkpDRUVGQ0RFQUEuZW1lYWRlQGdlZWtmYXJtLm9yZz4="
    }, 
    "authorName": "Erik Meade", 
    "numMessagesInTopic": 1, 
    "msgSnippet": "http://www-4.ibm.com/software/developer/library/j-ant/?dwzone=java", 
    "contentTrasformed": false, 
    "msgId": 49, 
    "nextInTopic": 0, 
    "systemMessage": false, 
    "rawEmail": "Return-Path: &lt;emeade@...&gt;\r\nX-Sender: emeade@...\r\nX-Apparently-To: junit@egroups.com\r\nReceived: (EGP: mail-6_3_1_2); 22 Nov 2000 03:18:49 -0000\r\nReceived: (qmail 49525 invoked from network); 22 Nov 2000 03:18:48 -0000\r\nReceived: from unknown (10.1.10.27) by m8.onelist.org with QMQP; 22 Nov 2000 03:18:48 -0000\r\nReceived: from unknown (HELO darius.concentric.net) (207.155.198.79) by mta2 with SMTP; 22 Nov 2000 03:18:48 -0000\r\nReceived: from newman.concentric.net (newman.concentric.net [207.155.198.71]) by darius.concentric.net (8.9.1a/(98/12/15 5.12)) id WAA06069; Tue, 21 Nov 2000 22:18:47 -0500 (EST) [1-800-745-2747 The Concentric Network]\r\nErrors-To: &lt;emeade@...&gt;\r\nReceived: from buji (w020.z064001255.sjc-ca.dsl.cnc.net [64.1.255.20]) by newman.concentric.net (8.9.1a) id WAA06934; Tue, 21 Nov 2000 22:18:47 -0500 (EST)\r\nReply-To: &lt;emeade@...&gt;\r\nTo: &lt;junit@egroups.com&gt;\r\nSubject: Incremental development with Ant and JUnit\r\nDate: Tue, 21 Nov 2000 19:18:33 -0800\r\nMessage-ID: &lt;DGELJGNMBMGEHFCKJNJCEEFCDEAA.emeade@...&gt;\r\nMIME-Version: 1.0\r\nContent-Type: text/plain; charset=&quot;iso-8859-1&quot;\r\nContent-Transfer-Encoding: 7bit\r\nX-Priority: 3 (Normal)\r\nX-MSMail-Priority: Normal\r\nX-Mailer: Microsoft Outlook IMO, Build 9.0.2416 (9.0.2911.0)\r\nX-MimeOLE: Produced By Microsoft MimeOLE V5.50.4133.2400\r\nImportance: Normal\r\nFrom: &quot;Erik Meade&quot; &lt;emeade@...&gt;\r\n\r\nhttp://www-4.ibm.com/software/developer/library/j-ant/?dwzone=java\n\n\n", 
    "subject": "Incremental development with Ant and JUnit"
}