{
    "topicId": 53, 
    "postDate": "975352675", 
    "spamInfo": {
        "reason": "0", 
        "isSpam": false
    }, 
    "from": "&quot;Jim Jackl-Mochel&quot; &lt;jmochel@...&gt;", 
    "canDelete": false, 
    "replyTo": "LIST", 
    "senderId": "VVVOfd_9UHX1H1QgoUf4z4JAspSrR0iX4_arCIRmfQ3UNstaNlAawWatD-AdiaKfp6ek07Jb-2Hl7UNzrTxFkOMCsTXsK2X7yB3TDaWLlw", 
    "nextInTime": 54, 
    "userId": 0, 
    "prevInTime": 52, 
    "prevInTopic": 0, 
    "headers": {
        "messageIdInHeader": "PEJBRVBKSUxMRE1PSEZHRUpNTE5LQ0VOR0NOQUEuam1vY2hlbEBmb2xpYWdlLmNvbT4="
    }, 
    "authorName": "Jim Jackl-Mochel", 
    "numMessagesInTopic": 3, 
    "msgSnippet": "I was wondering if anyone has coded up an test case base class that allows for file comparisons of output files ? I expect that it would look something like", 
    "contentTrasformed": false, 
    "msgId": 53, 
    "nextInTopic": 54, 
    "systemMessage": false, 
    "rawEmail": "Return-Path: &lt;jmochel@...&gt;\r\nX-Sender: jmochel@...\r\nX-Apparently-To: junit@egroups.com\r\nReceived: (EGP: mail-6_3_1_2); 27 Nov 2000 19:35:44 -0000\r\nReceived: (qmail 69112 invoked from network); 27 Nov 2000 19:22:04 -0000\r\nReceived: from unknown (10.1.10.142) by l10.egroups.com with QMQP; 27 Nov 2000 19:22:04 -0000\r\nReceived: from unknown (HELO gateway.foliage.com) (63.117.36.2) by mta3 with SMTP; 27 Nov 2000 20:23:09 -0000\r\nReceived: (from root@localhost) by gateway.foliage.com (8.9.3/8.9.3) id OAA31432 for junit@egroups.com.outgoing; Mon, 27 Nov 2000 14:22:02 -0500\r\nReceived: from devilmountain (devilmountain.corp.foliage.com [192.9.200.212]) by gateway.foliage.com (8.9.3/8.9.3) with SMTP id OAA31426 for &lt;junit@egroups.com&gt;; Mon, 27 Nov 2000 14:22:02 -0500\r\nTo: &quot;JUnit List&quot; &lt;junit@egroups.com&gt;\r\nSubject: Test File Output comparison : Should probably be an FAQ but I didn&#39;t see it so....\r\nDate: Mon, 27 Nov 2000 14:17:55 -0500\r\nMessage-ID: &lt;BAEPJILLDMOHFGEJMLNKCENGCNAA.jmochel@...&gt;\r\nMIME-Version: 1.0\r\nContent-Type: text/plain; charset=&quot;iso-8859-1&quot;\r\nContent-Transfer-Encoding: 7bit\r\nX-Priority: 3 (Normal)\r\nX-MSMail-Priority: Normal\r\nX-Mailer: Microsoft Outlook IMO, Build 9.0.2416 (9.0.2910.0)\r\nImportance: Normal\r\nX-MimeOLE: Produced By Microsoft MimeOLE V5.50.4133.2400\r\nFrom: &quot;Jim Jackl-Mochel&quot; &lt;jmochel@...&gt;\r\n\r\nI was wondering if anyone has coded up an test case base class that allows\nfor file comparisons of output files ? I expect that it would look something\nlike assertFilesEqual(file1, file2)\n\nThanks,\n\tJim JM\n\n\n\n\n\n", 
    "subject": "Test File Output comparison : Should probably be an FAQ but I didn&#39;t see it so...."
}