{
    "topicId": 71, 
    "postDate": "975620377", 
    "spamInfo": {
        "reason": "0", 
        "isSpam": false
    }, 
    "from": "&quot;Jim Jackl-Mochel&quot; &lt;jmochel@...&gt;", 
    "canDelete": false, 
    "replyTo": "LIST", 
    "senderId": "vwlFnAh8NEaWztiKLNLMJgjQBJSO7IZVWYi2AsBF5s4NkGpJ1cZSiQiFHssaE4Xgi4i_XLMOG-UG11Un0wJ4UncJjVUXb4l-8s3pGdRG-w", 
    "nextInTime": 72, 
    "userId": 0, 
    "prevInTime": 70, 
    "prevInTopic": 0, 
    "headers": {
        "messageIdInHeader": "PEJBRVBKSUxMRE1PSEZHRUpNTE5LRUVQT0NOQUEuam1vY2hlbEBmb2xpYWdlLmNvbT4="
    }, 
    "authorName": "Jim Jackl-Mochel", 
    "numMessagesInTopic": 2, 
    "msgSnippet": "In trying to make my unit tests very self contained I have come up against a small headache. In the case of those classes that read or manipulate a database ", 
    "contentTrasformed": false, 
    "msgId": 71, 
    "nextInTopic": 72, 
    "systemMessage": false, 
    "rawEmail": "Return-Path: &lt;jmochel@...&gt;\r\nX-Sender: jmochel@...\r\nX-Apparently-To: junit@egroups.com\r\nReceived: (EGP: mail-6_3_1_2); 30 Nov 2000 21:44:06 -0000\r\nReceived: (qmail 97275 invoked from network); 30 Nov 2000 21:43:24 -0000\r\nReceived: from unknown (10.1.10.26) by l10.egroups.com with QMQP; 30 Nov 2000 21:43:24 -0000\r\nReceived: from unknown (HELO gateway.foliage.com) (63.117.36.2) by mta1 with SMTP; 30 Nov 2000 21:43:23 -0000\r\nReceived: (from root@localhost) by gateway.foliage.com (8.9.3/8.9.3) id QAA01260 for junit@egroups.com.outgoing; Thu, 30 Nov 2000 16:43:22 -0500\r\nReceived: from devilmountain (devilmountain.corp.foliage.com [192.9.200.212]) by gateway.foliage.com (8.9.3/8.9.3) with SMTP id QAA01254 for &lt;junit@egroups.com&gt;; Thu, 30 Nov 2000 16:43:20 -0500\r\nTo: &quot;JUnit List&quot; &lt;junit@egroups.com&gt;\r\nSubject: Unit Testing JDBC database code.\r\nDate: Thu, 30 Nov 2000 16:39:37 -0500\r\nMessage-ID: &lt;BAEPJILLDMOHFGEJMLNKEEPOCNAA.jmochel@...&gt;\r\nMIME-Version: 1.0\r\nContent-Type: text/plain; charset=&quot;iso-8859-1&quot;\r\nContent-Transfer-Encoding: 7bit\r\nX-Priority: 3 (Normal)\r\nX-MSMail-Priority: Normal\r\nX-Mailer: Microsoft Outlook IMO, Build 9.0.2416 (9.0.2910.0)\r\nImportance: Normal\r\nX-MimeOLE: Produced By Microsoft MimeOLE V5.50.4133.2400\r\nFrom: &quot;Jim Jackl-Mochel&quot; &lt;jmochel@...&gt;\r\n\r\nIn trying to make my unit tests very self contained I have come up against a\nsmall\nheadache. In the case of those classes that read or manipulate a database\nvia JDBC I\nwould ideally like to create the database, manipulate it, and then remove\nthe database.\n\nHow have everybody else handled this sort of unit test ?\n\nJim JM\n\n\n", 
    "subject": "Unit Testing JDBC database code."
}