{
    "numMessagesInTopic": 1, 
    "nextInTime": 7567, 
    "senderId": "wXYSkp7abk0kNWO17NvCugudwDZuseDxTqww8xVgjs2TnMhK0nB5tZMhoWuB82-yGaINcEOhAHQPpQJgCD7O9qmTergNKM1VKDXrcKFo9gTViUQ", 
    "systemMessage": false, 
    "subject": "PMD - free tool instead of JTest", 
    "from": "&quot;Erik Mattsson&quot; &lt;erik.mattsson@...&gt;", 
    "authorName": "Erik Mattsson", 
    "msgSnippet": "After read a lot of posts about JTest and JUnit I just wanted to make a plug for a great and free tool. Its called PMD (http://pmd.sf.net) JTest had some", 
    "msgId": 7566, 
    "rawEmail": "Return-Path: &lt;erik.mattsson@...&gt;\r\nReceived: (qmail 77590 invoked from network); 7 Apr 2003 16:32:43 -0000\r\nReceived: from unknown (66.218.66.217)\n  by m8.grp.scd.yahoo.com with QMQP; 7 Apr 2003 16:32:43 -0000\r\nReceived: from unknown (HELO n20.grp.scd.yahoo.com) (66.218.66.76)\n  by mta2.grp.scd.yahoo.com with SMTP; 7 Apr 2003 16:32:43 -0000\r\nX-eGroups-Return: erik.mattsson@...\r\nReceived: from [66.218.67.129] by n20.grp.scd.yahoo.com with NNFMP; 07 Apr 2003 16:32:28 -0000\r\nX-Sender: erik.mattsson@...\r\nX-Apparently-To: junit@yahoogroups.com\r\nReceived: (EGP: mail-8_2_6_5); 7 Apr 2003 05:05:31 -0000\r\nReceived: (qmail 27566 invoked from network); 7 Apr 2003 05:05:31 -0000\r\nReceived: from unknown (66.218.66.216)\n  by m7.grp.scd.yahoo.com with QMQP; 7 Apr 2003 05:05:31 -0000\r\nReceived: from unknown (HELO lists.levonline.com) (217.70.33.37)\n  by mta1.grp.scd.yahoo.com with SMTP; 7 Apr 2003 05:05:31 -0000\r\nReceived: from vargen.levonline.com (tistel.levonline.com [193.15.191.188])\n\tby lists.levonline.com (Postfix) with ESMTP id 67423D0131\n\tfor &lt;junit@yahoogroups.com&gt;; Mon,  7 Apr 2003 07:37:26 +0200 (CEST)\r\nReceived: from bashfull (h134n2fls32o837.telia.com [217.209.137.134])\n\t(authenticated)\n\tby vargen.levonline.com (8.11.6/8.11.6) with ESMTP id h3755Ti01141\n\tfor &lt;junit@yahoogroups.com&gt;; Mon, 7 Apr 2003 07:05:29 +0200\r\nMessage-ID: &lt;004301c2fcc3$4f3f3580$0600a8c0@...&gt;\r\nTo: &lt;junit@yahoogroups.com&gt;\r\nSubject: PMD - free tool instead of JTest\r\nDate: Mon, 7 Apr 2003 07:05:29 +0200\r\nMIME-Version: 1.0\r\nContent-Type: text/plain;\n\tcharset=&quot;Windows-1252&quot;\r\nContent-Transfer-Encoding: 8bit\r\nX-Priority: 3\r\nX-MSMail-Priority: Normal\r\nX-Mailer: Microsoft Outlook Express 6.00.2800.1106\r\nX-MimeOLE: Produced By Microsoft MimeOLE V6.00.2800.1106\r\nFrom: &quot;Erik Mattsson&quot; &lt;erik.mattsson@...&gt;\r\nX-Yahoo-Group-Post: member; u=135813500\r\nX-Yahoo-Profile: erikmattsson73\r\nX-eGroups-Approved-By: clarkware &lt;mike@...&gt; via web; 07 Apr 2003 16:32:27 -0000\r\n\r\nAfter read a lot of posts about JTest and JUnit I just\nwanted to make a plug for a great and free tool. Its\ncalled PMD (http://pmd.sf.net)\n\nJTest had some source code analysis stuff that could be\nneat, this project has it also and is free. It works on\nyour java source code and helps developers to conform\nto coding idioms (not code standards). It will scan your\nsource code for potential problems and if you follow\nthe rules/suggestion you will get code that is simplier\nand more maintable.\n\n\nIt even has rules for coping with JUnit tests, so check it\nout and it will help you get a better code. There are\nplugins for most common Java IDEs.\n\n\n&lt;copied from project page&gt;\nPMD scans Java source code and looks for potential problems like:\n\n  a.. Unused local variables\n  b.. Empty catch blocks\n  c.. Unused parameters\n  d.. Empty &#39;if&#39; statements\n  e.. Duplicate import statements\n  f.. Unused private methods\n  g.. Classes which could be Singletons\n  h.. Short/long variable and method names\n  i.. A lot more\nSorry about this, but I just wanted everyone aware about\nthis neat tool to be used TOGETHER with JUnit.\n---------------------------------------------------------------------\nErik Mattsson\n\nimBridge AB\nVasaplatsen 8\nSE-411 34 Gï¿½teborg\n\nPhone: +46-31-138310\nMobile: +46-733-174116\nwww.imbridge.com\n\n\n\n", 
    "profile": "erikmattsson73", 
    "topicId": 7566, 
    "spamInfo": {
        "reason": "0", 
        "isSpam": false
    }, 
    "replyTo": "LIST", 
    "userId": 135813500, 
    "prevInTime": 7565, 
    "contentTrasformed": false, 
    "postDate": "1049691929", 
    "canDelete": false, 
    "nextInTopic": 0, 
    "prevInTopic": 0, 
    "headers": {
        "messageIdInHeader": "PDAwNDMwMWMyZmNjMyQ0ZjNmMzU4MCQwNjAwYThjMEBpbWJyaWRnZS5zZT4="
    }
}