{
    "numMessagesInTopic": 2, 
    "nextInTime": 7811, 
    "senderId": "FMReN6tU17DnGvvfZd3ek3cKKNI-SZCrI31hPQb16D7DEWU-fucA_F2odGkEdB_IKHSKnyrLje7EzbS4tcoVTQAeVcvC0hwCUL3UkssRbrtQceXk0a_R", 
    "systemMessage": false, 
    "subject": "Yet another runner", 
    "from": "&quot;Vladimir R. Bossicard&quot; &lt;vladimir@...&gt;", 
    "authorName": "Vladimir R. Bossicard", 
    "msgSnippet": "As some of you have already noticed, I have released the code of a TestRunner I have been working on for quite some time.  The main features of this runner", 
    "msgId": 7810, 
    "rawEmail": "Return-Path: &lt;vladimir@...&gt;\r\nX-Sender: vladimir@...\r\nX-Apparently-To: junit@yahoogroups.com\r\nReceived: (EGP: mail-8_2_6_5); 22 Apr 2003 04:38:42 -0000\r\nReceived: (qmail 36739 invoked from network); 22 Apr 2003 04:38:42 -0000\r\nReceived: from unknown (66.218.66.218)\n  by m13.grp.scd.yahoo.com with QMQP; 22 Apr 2003 04:38:42 -0000\r\nReceived: from unknown (HELO unet.scdi.org) (66.93.79.215)\n  by mta3.grp.scd.yahoo.com with SMTP; 22 Apr 2003 04:38:42 -0000\r\nReceived: from bossicard.com (adsl-67-116-239-245.dsl.pltn13.pacbell.net [67.116.239.245])\n\t(authenticated bits=0)\n\tby unet.scdi.org (8.12.3/8.12.3/Debian-6.3) with ESMTP id h3M4cew7017926\n\tfor &lt;junit@yahoogroups.com&gt;; Mon, 21 Apr 2003 21:38:40 -0700\r\nMessage-ID: &lt;3EA4C732.80409@...&gt;\r\nDate: Mon, 21 Apr 2003 21:38:10 -0700\r\nUser-Agent: Mozilla/5.0 (X11; U; Linux i686; en-US; rv:1.3) Gecko/20030312\r\nX-Accept-Language: en-us, en\r\nMIME-Version: 1.0\r\nTo: junit@yahoogroups.com\r\nSubject: Yet another runner\r\nContent-Type: text/plain; charset=us-ascii; format=flowed\r\nContent-Transfer-Encoding: 7bit\r\nX-Spam-Status: No\r\nX-Scanned-By: MIMEDefang 2.21 (www . roaringpenguin . com / mimedefang)\r\nFrom: &quot;Vladimir R. Bossicard&quot; &lt;vladimir@...&gt;\r\nX-Yahoo-Group-Post: member; u=43178095\r\nX-Yahoo-Profile: vbossica\r\n\r\nAs some of you have already noticed, I have released the code of a \nTestRunner I have been working on for quite some time.  The main \nfeatures of this runner are:\n\n- custom listeners\n- resources (like a connection to a database) shared by tests\n- properties split for the runner and tests\n- custom monitor (to manage the execution of the tests)\n\nThis runner is very flexible (IMO) and was designed especially for \nintegration tests.  You can download it from the JUnit-addons website.\n\n&lt;http://sf.net/projects/junit-addons&gt;\n\nThe (very short) documentation is available at:\n\n&lt;http://www.worldwidewiki.net/wiki/JunitAddonsRunner&gt;\n\nand of course there&#39;s the code.  If you think that the documentation is \nnot enough, you&#39;re free to contribute to it.  Please note that the \nsoftware is released AS IS:  I won&#39;t answer to private emails unless you \nhave attached some patch.\n\nIf you&#39;re ready to try someting risky, here&#39;s the ouput of a run:\n\n\nloading runner properties &#39;src/example/conf/runner.properties&#39;\nloading test properties &#39;src/example/conf/test.properties&#39;\nloading resource &#39;junitx.example.resource.VoidResource&#39;\nloading run monitor &#39;junitx.runner.monitor.DefaultMonitor&#39;\nloading listener &#39;junitx.example.listener.VoidRunListener&#39;\nloading listener &#39;junitx.runner.listener.DefaultConsole&#39;\nloading classname &#39;junitx.example.AllTests&#39;\n\nEF****FE\n\nElapsed time: 0.005 sec (8 tests + 3 ignored)\n\nIGNORED\n\n1) testFailure_ignored (junitx.example.IgnoredTestCase)\n2) testError_ignored (junitx.example.IgnoredTestCase)\n3) testSuccess_ignored (junitx.example.IgnoredTestCase)\n\nWARNINGS\n\n1) No tests found in junitx.example.WarningTestCase\n\nFAILURES\n\n1) testFailure (junitx.example.FailureTestCase)\njunit.framework.AssertionFailedError\n     at junitx.example.FailureTestCase.testFailure(FailureTestCase.java:12)\n\n2) testFailure (junitx.example.SetupFailTestCase)\njunit.framework.AssertionFailedError\n     at junitx.example.SetupFailTestCase.setUp(SetupFailTestCase.java:12)\n\nERRORS\n\n1) testError (junitx.example.ErrorTestCase)\njava.lang.NullPointerException\n     at junitx.example.ErrorTestCase.testError(ErrorTestCase.java:12)\n\n2) testFailure (junitx.example.SetupErrorTestCase)\njava.lang.NullPointerException\n     at junitx.example.SetupErrorTestCase.setUp(SetupErrorTestCase.java:12)\n\n\n-Vladimir\n\n-- \nVladimir R. Bossicard\nwww.bossicard.com\n\n\n", 
    "profile": "vbossica", 
    "topicId": 7810, 
    "spamInfo": {
        "reason": "0", 
        "isSpam": false
    }, 
    "replyTo": "LIST", 
    "userId": 43178095, 
    "prevInTime": 7809, 
    "contentTrasformed": false, 
    "postDate": "1050986290", 
    "canDelete": false, 
    "nextInTopic": 7811, 
    "prevInTopic": 0, 
    "headers": {
        "messageIdInHeader": "PDNFQTRDNzMyLjgwNDA5QGJvc3NpY2FyZC5jb20+"
    }
}